app_data.json

{
  "features": [
    "R&D Spend",
    "Administration",
    "Marketing Spend",
    "State_Florida",
    "State_New York"
  ],
  "full_model": {
    "intercept": 42554.16761773237,
    "coefs": {
      "R&D Spend": 0.7734671927328001,
      "Administration": 0.03288459753625596,
      "Marketing Spend": 0.036610025863856116,
      "State_Florida": -959.2841600571066,
      "State_New York": 699.3690525192583
    },
    "r2": 0.9347068473282423,
    "adj_r2": 0.8530904064885452,
    "rmse": 9137.990152794957,
    "mae": 7514.293659640612,
    "coef_table": [
      {
        "feature": "Intercept",
        "coef": 42554.16761773237,
        "se": 8358.538206708845,
        "t": 5.091101645450033,
        "p": 1.3086760335401237e-05,
        "ci_low": 25569.617981699994,
        "ci_high": 59538.71725376474,
        "vif": null
      },
      {
        "feature": "R&D Spend",
        "coef": 0.7734671927328001,
        "se": 0.05514906906539134,
        "t": 14.025027182520247,
        "p": 1.1102230246251565e-15,
        "ci_low": 0.6614042843919249,
        "ci_high": 0.8855301010736752,
        "vif": 2.4955109215494433
      },
      {
        "feature": "Administration",
        "coef": 0.03288459753625596,
        "se": 0.06646820999602664,
        "t": 0.4947417350071823,
        "p": 0.6239644295843965,
        "ci_low": -0.10217880517567017,
        "ci_high": 0.16794800024818207,
        "vif": 1.177766050899384
      },
      {
        "feature": "Marketing Spend",
        "coef": 0.036610025863856116,
        "se": 0.019427464932907774,
        "t": 1.884446889508634,
        "p": 0.06807739016599168,
        "ci_low": -0.0028665828798124793,
        "ci_high": 0.07608663460752471,
        "vif": 2.4167967566863933
      },
      {
        "feature": "State_Florida",
        "coef": -959.2841600571066,
        "se": 4038.10772138052,
        "t": -0.23755784299116053,
        "p": 0.8136497729181498,
        "ci_low": -9164.719049902324,
        "ci_high": 7246.150729788111,
        "vif": 1.3876413029723562
      },
      {
        "feature": "State_New York",
        "coef": 699.3690525192583,
        "se": 3661.562727359724,
        "t": 0.19100288718078542,
        "p": 0.8496593413793958,
        "ci_low": -6740.9264094757,
        "ci_high": 8139.664514514217,
        "vif": 1.335060876962854
      }
    ],
    "test_actual": [
      103282.38,
      144259.4,
      146121.95,
      77798.83,
      191050.39,
      105008.31,
      81229.06,
      97483.56,
      110352.25,
      166187.94
    ],
    "test_pred": [
      103015.2015979618,
      132582.27760815565,
      132447.73845174478,
      71976.09851257896,
      178537.48221055063,
      116161.24230165101,
      67851.69209675622,
      98791.7337468745,
      113969.43533012443,
      167921.0656955042
    ]
  },
  "top2_model": {
    "intercept": 46346.338761236555,
    "coefs": {
      "R&D Spend": 0.7886182999424615,
      "Marketing Spend": 0.032576627317020684
    },
    "r2": 0.9474386447268488,
    "rmse": 8198.797190788488,
    "mae": 6886.594588246514,
    "test_pred": [
      102284.64605182887,
      133873.92383811908,
      134182.14951650103,
      73701.10693630342,
      180642.25299736104,
      114717.24903894303,
      68335.07575312015,
      97433.45922275007,
      114580.92136452152,
      170343.3197949842
    ]
  },
  "forward_selection_table": [
    {
      "step": 1,
      "num": 1,
      "features": [
        "R&D Spend"
      ],
      "rmse": 8274.868,
      "r2": 0.946459
    },
    {
      "step": 2,
      "num": 2,
      "features": [
        "R&D Spend",
        "Marketing Spend"
      ],
      "rmse": 8198.797,
      "r2": 0.947439,
      "best": true
    },
    {
      "step": 3,
      "num": 3,
      "features": [
        "R&D Spend",
        "Marketing Spend",
        "State_New York"
      ],
      "rmse": 8309.06,
      "r2": 0.946015
    },
    {
      "step": 4,
      "num": 4,
      "features": [
        "R&D Spend",
        "Marketing Spend",
        "State_New York",
        "State_Florida"
      ],
      "rmse": 8409.917,
      "r2": 0.944697
    },
    {
      "step": 5,
      "num": 5,
      "features": [
        "All 5 Features"
      ],
      "rmse": 9137.99,
      "r2": 0.934707
    }
  ],
  "raw_data": [
    {
      "R&D Spend": 165349.2,
      "Administration": 136897.8,
      "Marketing Spend": 471784.1,
      "State": "New York",
      "Profit": 192261.83
    },
    {
      "R&D Spend": 162597.7,
      "Administration": 151377.59,
      "Marketing Spend": 443898.53,
      "State": "California",
      "Profit": 191792.06
    },
    {
      "R&D Spend": 153441.51,
      "Administration": 101145.55,
      "Marketing Spend": 407934.54,
      "State": "Florida",
      "Profit": 191050.39
    },
    {
      "R&D Spend": 144372.41,
      "Administration": 118671.85,
      "Marketing Spend": 383199.62,
      "State": "New York",
      "Profit": 182901.99
    },
    {
      "R&D Spend": 142107.34,
      "Administration": 91391.77,
      "Marketing Spend": 366168.42,
      "State": "Florida",
      "Profit": 166187.94
    },
    {
      "R&D Spend": 131876.9,
      "Administration": 99814.71,
      "Marketing Spend": 362861.36,
      "State": "New York",
      "Profit": 156991.12
    },
    {
      "R&D Spend": 134615.46,
      "Administration": 147198.87,
      "Marketing Spend": 127716.82,
      "State": "California",
      "Profit": 156122.51
    },
    {
      "R&D Spend": 130298.13,
      "Administration": 145530.06,
      "Marketing Spend": 323876.68,
      "State": "Florida",
      "Profit": 155752.6
    },
    {
      "R&D Spend": 120542.52,
      "Administration": 148718.95,
      "Marketing Spend": 311613.29,
      "State": "New York",
      "Profit": 152211.77
    },
    {
      "R&D Spend": 123334.88,
      "Administration": 108679.17,
      "Marketing Spend": 304981.62,
      "State": "California",
      "Profit": 149759.96
    },
    {
      "R&D Spend": 101913.08,
      "Administration": 110594.11,
      "Marketing Spend": 229160.95,
      "State": "Florida",
      "Profit": 146121.95
    },
    {
      "R&D Spend": 100671.96,
      "Administration": 91790.61,
      "Marketing Spend": 249744.55,
      "State": "California",
      "Profit": 144259.4
    },
    {
      "R&D Spend": 93863.75,
      "Administration": 127320.38,
      "Marketing Spend": 249839.44,
      "State": "Florida",
      "Profit": 141585.52
    },
    {
      "R&D Spend": 91992.39,
      "Administration": 135495.07,
      "Marketing Spend": 252664.93,
      "State": "California",
      "Profit": 134307.35
    },
    {
      "R&D Spend": 119943.24,
      "Administration": 156547.42,
      "Marketing Spend": 256512.92,
      "State": "Florida",
      "Profit": 132602.65
    },
    {
      "R&D Spend": 114523.61,
      "Administration": 122616.84,
      "Marketing Spend": 261776.23,
      "State": "New York",
      "Profit": 129917.04
    },
    {
      "R&D Spend": 78013.11,
      "Administration": 121597.55,
      "Marketing Spend": 264346.06,
      "State": "California",
      "Profit": 126992.93
    },
    {
      "R&D Spend": 94657.16,
      "Administration": 145077.58,
      "Marketing Spend": 282574.31,
      "State": "New York",
      "Profit": 125370.37
    },
    {
      "R&D Spend": 91749.16,
      "Administration": 114175.79,
      "Marketing Spend": 294919.57,
      "State": "Florida",
      "Profit": 124266.9
    },
    {
      "R&D Spend": 86419.7,
      "Administration": 153514.11,
      "Marketing Spend": 0.0,
      "State": "New York",
      "Profit": 122776.86
    },
    {
      "R&D Spend": 76253.86,
      "Administration": 113867.3,
      "Marketing Spend": 298664.47,
      "State": "California",
      "Profit": 118474.03
    },
    {
      "R&D Spend": 78389.47,
      "Administration": 153773.43,
      "Marketing Spend": 299737.29,
      "State": "New York",
      "Profit": 111313.02
    },
    {
      "R&D Spend": 73994.56,
      "Administration": 122782.75,
      "Marketing Spend": 303319.26,
      "State": "Florida",
      "Profit": 110352.25
    },
    {
      "R&D Spend": 67532.53,
      "Administration": 105751.03,
      "Marketing Spend": 304768.73,
      "State": "Florida",
      "Profit": 108733.99
    },
    {
      "R&D Spend": 77044.01,
      "Administration": 99281.34,
      "Marketing Spend": 140574.81,
      "State": "New York",
      "Profit": 108552.04
    },
    {
      "R&D Spend": 64664.71,
      "Administration": 139553.16,
      "Marketing Spend": 137962.62,
      "State": "California",
      "Profit": 107404.34
    },
    {
      "R&D Spend": 75328.87,
      "Administration": 144135.98,
      "Marketing Spend": 134050.07,
      "State": "Florida",
      "Profit": 105733.54
    },
    {
      "R&D Spend": 72107.6,
      "Administration": 127864.55,
      "Marketing Spend": 353183.81,
      "State": "New York",
      "Profit": 105008.31
    },
    {
      "R&D Spend": 66051.52,
      "Administration": 182645.56,
      "Marketing Spend": 118148.2,
      "State": "Florida",
      "Profit": 103282.38
    },
    {
      "R&D Spend": 65605.48,
      "Administration": 153032.06,
      "Marketing Spend": 107138.38,
      "State": "New York",
      "Profit": 101004.64
    },
    {
      "R&D Spend": 61994.48,
      "Administration": 115641.28,
      "Marketing Spend": 91131.24,
      "State": "Florida",
      "Profit": 99937.59
    },
    {
      "R&D Spend": 61136.38,
      "Administration": 152701.92,
      "Marketing Spend": 88218.23,
      "State": "New York",
      "Profit": 97483.56
    },
    {
      "R&D Spend": 63408.86,
      "Administration": 129219.61,
      "Marketing Spend": 46085.25,
      "State": "California",
      "Profit": 97427.84
    },
    {
      "R&D Spend": 55493.95,
      "Administration": 103057.49,
      "Marketing Spend": 214634.81,
      "State": "Florida",
      "Profit": 96778.92
    },
    {
      "R&D Spend": 46426.07,
      "Administration": 157693.92,
      "Marketing Spend": 210797.67,
      "State": "California",
      "Profit": 96712.8
    },
    {
      "R&D Spend": 46014.02,
      "Administration": 85047.44,
      "Marketing Spend": 205517.64,
      "State": "New York",
      "Profit": 96479.51
    },
    {
      "R&D Spend": 28663.76,
      "Administration": 127056.21,
      "Marketing Spend": 201126.82,
      "State": "Florida",
      "Profit": 90708.19
    },
    {
      "R&D Spend": 44069.95,
      "Administration": 51283.14,
      "Marketing Spend": 197029.42,
      "State": "California",
      "Profit": 89949.14
    },
    {
      "R&D Spend": 20229.59,
      "Administration": 65947.93,
      "Marketing Spend": 185265.1,
      "State": "New York",
      "Profit": 81229.06
    },
    {
      "R&D Spend": 38558.51,
      "Administration": 82982.09,
      "Marketing Spend": 174999.3,
      "State": "California",
      "Profit": 81005.76
    },
    {
      "R&D Spend": 28754.33,
      "Administration": 118546.05,
      "Marketing Spend": 172795.67,
      "State": "California",
      "Profit": 78239.91
    },
    {
      "R&D Spend": 27892.92,
      "Administration": 84710.77,
      "Marketing Spend": 164470.71,
      "State": "Florida",
      "Profit": 77798.83
    },
    {
      "R&D Spend": 23640.93,
      "Administration": 96189.63,
      "Marketing Spend": 148001.11,
      "State": "California",
      "Profit": 71498.49
    },
    {
      "R&D Spend": 15505.73,
      "Administration": 127382.3,
      "Marketing Spend": 35534.17,
      "State": "New York",
      "Profit": 69758.98
    },
    {
      "R&D Spend": 22177.74,
      "Administration": 154806.14,
      "Marketing Spend": 28334.72,
      "State": "California",
      "Profit": 65200.33
    },
    {
      "R&D Spend": 1000.23,
      "Administration": 124153.04,
      "Marketing Spend": 1903.93,
      "State": "New York",
      "Profit": 64926.08
    },
    {
      "R&D Spend": 1315.46,
      "Administration": 115816.21,
      "Marketing Spend": 297114.46,
      "State": "Florida",
      "Profit": 49490.75
    },
    {
      "R&D Spend": 0.0,
      "Administration": 135426.92,
      "Marketing Spend": 0.0,
      "State": "California",
      "Profit": 42559.73
    },
    {
      "R&D Spend": 542.05,
      "Administration": 51743.15,
      "Marketing Spend": 0.0,
      "State": "New York",
      "Profit": 35673.41
    },
    {
      "R&D Spend": 0.0,
      "Administration": 116983.8,
      "Marketing Spend": 45173.06,
      "State": "California",
      "Profit": 14681.4
    }
  ]
}

README.md

### Step 4: 模型建立 (Modeling) & 五大迴歸假定

使用普通最小平方法（Ordinary Least Squares, OLS）建立多元線性迴歸模型：
$$\hat{y} = 42554.17 + 0.7735 \cdot (\text{R\&D}) + 0.0329 \cdot (\text{Admin}) + 0.0366 \cdot (\text{Mkt}) - 959.28 \cdot (\text{FL}) + 699.37 \cdot (\text{NY})$$